{
  "id": "ng-product-phase-out",
  "order": 62,
  "label": "Phasing out and blocking discontinued products",
  "description": "Finding products to drop, planning retirement and successors, and blocking discontinued items.",
  "type": "bpc",
  "area": "Products & items",
  "relevance": "low",
  "statements": [
    "Phasing out and blocking discontinued products",
    "Finding products to drop, planning retirement and successors, and blocking discontinued items.",
    "We carry 20,000 items and suspect half of them never sell",
    "Which products should we drop from our range?",
    "range review tool",
    "We want an annual review of our product portfolio with margin, volume and trend",
    "Is there a way to rank our items so we know where to cut?",
    "Management asks what our tail of slow sellers costs us",
    "We are phasing out a product line and need a plan for remaining stock and open orders",
    "How do we coordinate sales, purchasing and warehouse when we discontinue an item?",
    "end of life plan for products",
    "Last time we stopped a product we still had a year of components left over",
    "We want a last time buy plan before the product is retired",
    "Is there a tool to plan product discontinuation with tasks and dates?",
    "When an item is replaced we want BC to suggest the new one on sales orders",
    "successor item replacement",
    "Customer price agreements for discontinued items need to move to the new model",
    "We need to remove the old product from all catalogs and marketing materials",
    "How do we tell customers that a product is being replaced?",
    "Item substitution is set up but sales reps still sell the old item",
    "Discontinued items keep getting reordered by planning",
    "How do I block an item for sales but still let the warehouse ship open orders?",
    "item blocked purchase sales",
    "Old items still show up in MRP suggestions",
    "We want to cancel all open demand for an item we stopped selling",
    "Sales reps still quote products that we discontinued last year"
  ],
  "questions": []
}
