{
  "id": "ng-hr-skills-training",
  "order": 131,
  "label": "Tracking skills, certificates and training",
  "description": "Recording employee skills and certifications, designing learning paths, booking training and reporting on completion and skill gaps.",
  "type": "bpc",
  "area": "People & payroll",
  "relevance": "medium",
  "statements": [
    "Tracking skills, certificates and training",
    "Recording employee skills and certifications, designing learning paths, booking training and reporting on completion and skill gaps.",
    "Which technicians are certified for gas boilers and when do their certificates expire?",
    "We keep employee certificates in a binder and miss renewals",
    "skills matrix employees",
    "Is there an app to record skills on employees and find who can do a job?",
    "Forklift licences and first aid courses: we need reminders before they expire",
    "Our project managers can't see which consultants know a certain area",
    "Electricians must have valid authorisations before we send them out, and we need to track it",
    "We want employees to keep their own skills and education up to date",
    "Store education, languages and courses on each employee",
    "Customers ask for CVs and certifications of the people we send",
    "Rate each employee's level in key skills once a year",
    "Machine operators need to be qualified per machine and we track it in Excel",
    "Which skills are we missing to take on the new service contract?",
    "Compare what each employee can do with what their role requires",
    "skill gap analysis",
    "We need to know who needs training before the new machine arrives",
    "Find an internal person who matches the requirements of an open role",
    "Our team lacks people with automation skills, how big is the gap?",
    "We want a set training program for new sales reps",
    "learning path",
    "Plan which courses each role must take and in which order",
    "Create courses and let employees sign up",
    "Our training plan for technicians lives in someone's head",
    "Connect our learning platform with employee records",
    "Book employees on courses and track attendance",
    "Mandatory safety training gets missed every year",
    "training registration employees",
    "Want to know who attended which course and who didn't show up",
    "Course fees per employee and which department pays",
    "We run in-house training and sign-up happens by email",
    "Who has completed the mandatory courses this year?",
    "training records report",
    "Training history per employee",
    "What percentage of staff finished compliance training?",
    "Pull course completions from our e-learning platform into employee records",
    "Auditor asks for proof staff completed GDPR training"
  ],
  "questions": []
}
